<?xml version="1.0" encoding="UTF-8"?>
<!DOCTYPE setting PUBLIC "-//Dragon Field//DTD//EN" "http://localhost/dtd/setting.dtd">
<setting root="C:/work">
  <system_group name="TEST">
	  <instance name="instance" location="./data/server">
	  	<awrrep />
	  	<ash />
	  	<activeses />
	  	<client />
	  	<lckchk />
	  	<pgamem />
	  	<sessionw />
	  	<sysevent />
	  	<sysstat />
	  	<undo />
	  </instance>
	</system_group>
</setting>

